{
  "$schema": "../schemas/piece.schema.json",
  "piece_id": "czerny_op821_001",
  "canonical_work_id": "czerny_op821_001",
  "record_kind": "work",
  "display_title": "160 Short Exercises — Exercise 1",
  "catalogue_group": "piano_core",
  "known_metadata": {
    "composer": "Carl Czerny",
    "collection_id": "czerny_op821",
    "collection_title": "160 kurze Übungen",
    "opus_or_catalogue": "Op.821",
    "number": "1",
    "subdivision": null,
    "original_title": null,
    "instrumentation": "piano_solo",
    "source_reported_key": null,
    "metadata_basis": "catalogue_enumeration"
  },
  "pedagogy": {
    "intended_use": [
      "sight_reading"
    ],
    "curation_priority": 1,
    "verified_suitability": null,
    "tags": []
  },
  "availability": {
    "status": "catalogue_only",
    "download_status": "pending",
    "local_score_path": null,
    "selected_asset_id": null,
    "playable": false
  },
  "assets": [],
  "rights": {
    "composition_status": "public_domain_reported",
    "edition_status": "pending_review",
    "license_id": null,
    "evidence_ids": [
      "imslp_czerny_op821"
    ],
    "attribution": "Carl Czerny; bibliographic reference: IMSLP (https://imslp.org/wiki/160_kurze_%C3%9Cbungen%2C_Op.821_%28Czerny%2C_Carl%29).",
    "target_jurisdictions": [],
    "distribution_status": "pending_review"
  },
  "provenance": [
    {
      "evidence_id": "imslp_czerny_op821",
      "fields": [
        "known_metadata",
        "piece_id",
        "display_title",
        "rights.composition_status"
      ],
      "source_record": "1"
    }
  ],
  "analysis": {
    "status": "pending",
    "parser_version": null,
    "algorithm_version": null,
    "input_asset_id": null,
    "input_sha256": null,
    "computed_at": null,
    "error": null,
    "metrics": {
      "measure_count": null,
      "duration_quarter_notes": null,
      "key_signatures": null,
      "estimated_key": null,
      "time_signatures": null,
      "lowest_note": null,
      "highest_note": null,
      "right_hand_range": null,
      "left_hand_range": null,
      "hand_assignment": null,
      "accidentals": null,
      "voice_count": null,
      "max_chord_notes": null,
      "max_simultaneous_notes": null,
      "max_melodic_leap_semitones": null,
      "rhythm_values": null,
      "tuplets_present": null,
      "syncopation_ratio": null,
      "note_density_per_quarter": null,
      "hand_independence_score": null,
      "sightreading_score": null,
      "sightreading_level": null
    },
    "warnings": []
  },
  "notes": [
    "Individual entry enumerated from the catalogue; the display title is an editorial label. This does not imply that a MusicXML file has been located."
  ]
}
